{
  "api_version": "agent-platform/v1alpha1",
  "kind": "Task",
  "metadata": {
    "id": "tsk_0198f6d0-7ef0-7b0e-a0d3-5f9c96c7f411",
    "revision": 1,
    "scope": {
      "type": "project",
      "tenant_id": "ten_0198f6d0-7ef0-7b0e-a0d3-5f9c96c7f411",
      "user_id": "usr_0198f6d0-7ef0-7b0e-a0d3-5f9c96c7f411",
      "project_id": "prj_0198f6d0-7ef0-7b0e-a0d3-5f9c96c7f411"
    },
    "labels": {
      "domain": "development",
      "priority": "high"
    },
    "annotations": {
      "source_message_id": "msg_12345"
    },
    "created_at": "2026-09-01T12:00:00Z",
    "created_by": {
      "actor_type": "user",
      "actor_id": "usr_0198f6d0-7ef0-7b0e-a0d3-5f9c96c7f411",
      "tenant_id": "ten_0198f6d0-7ef0-7b0e-a0d3-5f9c96c7f411"
    }
  },
  "spec": {
    "title": "为项目增加用户设置页面",
    "intent": "development.implement_feature",
    "domain": "development",
    "requested_by": {
      "actor_type": "user",
      "actor_id": "usr_0198f6d0-7ef0-7b0e-a0d3-5f9c96c7f411",
      "tenant_id": "ten_0198f6d0-7ef0-7b0e-a0d3-5f9c96c7f411"
    },
    "source": {
      "type": "openclaw",
      "channel": "feishu",
      "source_message_id": "msg_12345"
    },
    "payload": {
      "repository_ref": "repo_demo",
      "requirement_artifact_ref": "art_requirement",
      "description": "实现用户设置页面，包括个人信息编辑、密码修改、通知偏好设置"
    },
    "input_schema_ref": {
      "id": "sch_programming_task",
      "version": "1.0.0",
      "digest": "sha256:e3b0c44298fc1c149afbf4c8996fb92427ae41e4649b934ca495991b7852b855"
    },
    "expected_output_schema_ref": {
      "id": "sch_programming_result",
      "version": "1.0.0",
      "digest": "sha256:a7ffc6f8bf1ed76651c14756a061d662f580ff4de43b49fa82d80a4b80f8434a"
    },
    "input_artifact_refs": [
      {
        "kind": "Artifact",
        "id": "art_0198f6d0-7ef0-7b0e-a0d3-5f9c96c7f411",
        "digest": "sha256:b3a8e0e1e0e0e0e0e0e0e0e0e0e0e0e0e0e0e0e0e0e0e0e0e0e0e0e0e0e0e0e0"
      }
    ],
    "requested_agent_ref": {
      "kind": "AgentSpec",
      "id": "agt_0198f6d0-7ef0-7b0e-a0d3-5f9c96c7f411",
      "version": "1.0.0",
      "digest": "sha256:c4a8e0e1e0e0e0e0e0e0e0e0e0e0e0e0e0e0e0e0e0e0e0e0e0e0e0e0e0e0e0e0"
    },
    "routing_constraints": {
      "allowed_agent_refs": [],
      "allowed_domains": ["development"],
      "required_model_capabilities": ["tool_calling", "structured_output"]
    },
    "priority": 50,
    "schedule": {
      "mode": "immediate"
    },
    "dependencies": [],
    "budget": {
      "max_wall_time_seconds": 7200,
      "max_model_input_tokens": 500000,
      "max_model_output_tokens": 200000,
      "max_model_tokens": 800000,
      "max_cost_usd": "30.00",
      "max_tool_calls": 100,
      "max_iterations": 20
    },
    "permission_grant": {
      "actions": ["repository.read", "repository.write", "file.read", "file.write"],
      "resources": ["project:prj_demo/repository:*"],
      "expires_at": "2026-09-02T12:00:00Z"
    },
    "approval_policy_ref": {
      "kind": "PermissionProfile",
      "id": "pep_0198f6d0-7ef0-7b0e-a0d3-5f9c96c7f411",
      "version": "1.0.0",
      "digest": "sha256:d5a8e0e1e0e0e0e0e0e0e0e0e0e0e0e0e0e0e0e0e0e0e0e0e0e0e0e0e0e0e0e0"
    },
    "idempotency_key": "openclaw:feishu:message-12345",
    "deadline_at": "2026-09-01T18:00:00Z",
    "retention_policy": {
      "retain_days": 90,
      "legal_hold": false
    }
  },
  "status": {
    "phase": "created"
  }
}
